{
  "id": "brainstorm-to-mirror",
  "name": "Idea to Public Release",
  "description": "Takes a rough idea all the way from planning through implementation, committing, and a public mirror release -- the canonical end-to-end Jenga workflow chain.",
  "keywords": [
    "idea to release",
    "plan and ship",
    "idea to done",
    "full workflow",
    "end to end",
    "plan build ship",
    "idea to production"
  ],
  "examples": [
    "I have an idea, help me plan it, build it, and ship it",
    "take this feature from idea to committed and published",
    "let's go from a rough idea all the way to a public release",
    "plan this out, implement it, commit it, and push it to the public mirror",
    "walk this through the whole pipeline from brainstorm to release"
  ],
  "steps": ["brainstorm", "todo", "do", "dev-done", "mirror-public"]
}
